{
  "key": "species-kyuzo-strong-legged",
  "name": "Strong-Legged",
  "grantedBy": "species",
  "grantedByName": "Kyuzo",
  "description": "When you make a long jump, you can cover a number of feet up to twice your Strength score. When you make a high jump, you can leap a number of feet up into the air equal to 3 + twice your Strength modifier.",
  "sourceKey": "ec",
  "contentSet": "expanded-content"
}
