{
  "key": "archetype-path-of-the-corsair-bonus-proficiencies-3",
  "name": "Bonus Proficiencies",
  "grantedBy": "archetype",
  "grantedByName": "Path of the Corsair",
  "level": 3,
  "description": "_**Path of the Corsair:** 3rd level_\nYou gain proficiency with demolitions kits and three blasters of your choice.",
  "sourceKey": "phb",
  "contentSet": "core"
}
