{
  "key": "archetype-way-of-lightning-electric-attunement-14",
  "name": "Electric Attunement",
  "grantedBy": "archetype",
  "grantedByName": "Way of Lightning",
  "level": 14,
  "description": "_**Way of Lightning:** 14th level_\nYou gain resistance to lightning damage, and force powers you cast ignore resistance to lightning damage.",
  "sourceKey": "phb",
  "contentSet": "core"
}
