{
  "key": "archetype-scrapper-practice-dark-arts-3",
  "name": "Dark Arts",
  "grantedBy": "archetype",
  "grantedByName": "Scrapper Practice",
  "level": 3,
  "description": "_**Shadow Killer Practice:** 3rd level_\nYou learn to combine poison and stealth to perform assassination techniques. When you deal Sneak Attack damage to a creature you may choose to forgo two of your Sneak Attack dice to make the attack a dark art.\n___\n**Dark Arts save DC** = 8 + your proficiency bonus + your Intelligence modifier\n___\n#### Envenomed Art\nYou attempt to poison the target. The target must make a Constitution saving throw or be poisoned until the end of your next turn.\n#### Hallucinatory Art\nYou attempt to blind the target. The target must make a Wisdom saving throw or be blinded until the end of your next turn.\n#### Vanishing Art\nYou feint to momentarily disappear from your target's purview. The target must make a Dexterity saving throw. On a failure, you can move up to 10 feet without provoking opportunity attacks from the target."
}
