{
  "key": "archetype-way-of-confluence-life-eternal-10",
  "name": "Life Eternal",
  "grantedBy": "archetype",
  "grantedByName": "Way of Confluence",
  "level": 10,
  "description": "_**Way of Confluence:** 10th level_\nYou can use your powerful connection to the Force to keep fighting when others would fall. When you are reduced to 0 hit points but not killed outright, you can spend 5 force points to drop to 1 hit point instead.",
  "sourceKey": "ec",
  "contentSet": "expanded-content"
}
