{
  "key": "archetype-aqinos-form-droid-companion-3",
  "name": "Droid Companion",
  "grantedBy": "archetype",
  "grantedByName": "Aqinos Form",
  "level": 3,
  "description": "_**Aqinos Form:** 3rd, 5th, 9th, 11th, 13th, and 17th level_\nYou learn to employ all the knowledge you've accumulated to create, customize, and bond with your own droid companion.\nCreate your droid companion as detailed in the Companions section of the Customization Options document for Expanded Content. You must have astrotech's implements in order to create your droid.\nIf your companion is irreparably destroyed, or you want a companion, you must first break the bond with your current companion. Bonding with a new companion takes 8 hours spent in an appropriate location. You may only have one companion at a time.\nIn addition to its traits and features, your droid companion gains additional benefits while it is bonded to you:\n- Your companion is a valid target of the *tracker droid interface* tech power.\n- Your companion gains two additional traits. It gains one more additional trait when you reach 11th level in this class. For each companion trait in excess of your proficiency bonus, your force point maximum is reduced by 2. Over the course of a long rest, you can replace or remove a number of companion traits equal to half your Intelligence modifier (minimum of one).\nLastly, while bonded and within 10 feet of you, your companion can cast the tech powers you know without expending tech points. If your companion casts an at-will power in this way, it does not scale normally at higher levels. Instead, if it would scale at 5th level, it instead scales at 11th level, and if it would scale at 11th level, it instead scales at 17th level. If your companion casts a power of 2nd-level or higher, it consumes a number of uses of this feature equal to that power's level. At 11th level, your droid companion must be within 30 feet of you to benefit from this feature. At 17th level, your droid companion must be within 60 feet. You can use this feature twice. You gain an additional use at 5th, 9th, 13th, and 17th level. You regain all expended uses when you finish a long rest.",
  "sourceKey": "ec",
  "contentSet": "expanded-content"
}
