{
  "key": "species-lurmen-treeclimber",
  "name": "Treeclimber",
  "grantedBy": "species",
  "grantedByName": "Lurmen",
  "description": "You have a climbing speed of 25 feet. You have advantage on Strength saving throws and Strength (Athletics) checks that involve climbing.",
  "sourceKey": "ec",
  "contentSet": "expanded-content"
}
