{
  "key": "species-aqualish-darkvision",
  "name": "Darkvision",
  "grantedBy": "species",
  "grantedByName": "Aqualish",
  "description": "You have a keen eyesight, especially in the dark. You can see in dim light within 60 feet of you as if it were bright light, and in darkness as if it were dim light. You can't discern color in darkness, only shades of gray.",
  "sourceKey": "ec",
  "contentSet": "expanded-content"
}
